{
  "$schema": "https://xmintake.github.io/registry/spec/registry/registry-destination.schema.json",
  "id": "purchase-order",
  "source": "https://xmintake.github.io/registry/destinations/xmintake/purchase-order.destination.json",
  "title": "Purchase order",
  "description": "An order you placed: the PO code, the vendor, quantities, and a scan.",
  "color": "#1565C0",
  "destinationType": "GOOGLE_SHEET",
  "sheetMode": "TEMPLATE",
  "schemaUrl": "https://xmintake.github.io/registry/schemas/xmintake/purchase-order.schema.json",
  "visibility": "PUBLIC",
  "primaryCategory": "other",
  "tags": [
    "purchase",
    "order"
  ],
  "registryStatus": "ACTIVE",
  "createdAt": "2026-10-21T03:51:24Z",
  "issuedAt": "2026-10-21T03:51:24Z",
  "expiresAt": "2027-10-21T03:51:24Z",
  "certificate": {
    "publisher": {
      "name": "XMIntake",
      "type": "COMMUNITY",
      "website": "https://www.xmarin.dev",
      "supportEmail": "support@xmarin.dev",
      "supportPhone": "+1-765-532-6151"
    },
    "quotaPolicy": "SPONSORED",
    "createdAt": "2026-10-21T03:51:24Z",
    "issuedAt": "2026-10-21T03:51:24Z",
    "expiresAt": "2027-10-21T03:51:24Z",
    "signature": "kC/81gNZal2EeDUJ/aEjqB+6htNkr4ZjXBN131cAQwbRBWTbHP9ZK/baEZKODY2IcbcK37vaFQdMWb2QMhDVCQ=="
  }
}
