{
  "$schema": "https://xmintake.github.io/registry/spec/registry/registry-destination.schema.json",
  "id": "delivery-proof",
  "source": "https://xmintake.github.io/registry/destinations/xmintake/delivery-proof.destination.json",
  "title": "Delivery proof",
  "description": "Proof a delivery was made: tracking code, recipient code, photo, and pin.",
  "color": "#EF6C00",
  "destinationType": "GOOGLE_SHEET",
  "sheetMode": "TEMPLATE",
  "schemaUrl": "https://xmintake.github.io/registry/schemas/xmintake/delivery-proof.schema.json",
  "visibility": "PUBLIC",
  "primaryCategory": "field-work",
  "tags": [
    "delivery",
    "proof"
  ],
  "registryStatus": "ACTIVE",
  "createdAt": "2026-10-21T03:51:22Z",
  "issuedAt": "2026-10-21T03:51:22Z",
  "expiresAt": "2027-10-21T03:51:22Z",
  "certificate": {
    "publisher": {
      "name": "XMIntake",
      "type": "COMMUNITY",
      "website": "https://www.xmarin.dev",
      "supportEmail": "support@xmarin.dev",
      "supportPhone": "Not listed"
    },
    "quotaPolicy": "SPONSORED",
    "createdAt": "2026-10-21T03:51:22Z",
    "issuedAt": "2026-10-21T03:51:22Z",
    "expiresAt": "2027-10-21T03:51:22Z",
    "signature": "HrHWs5Vi1CHs9sqiO5AXY6nd8zZxmRJ1ot5aib5Cw8baUSBwaFnLDsciuxlEDCYrhWD2pgjLnOHUzJW4FqRUDg=="
  }
}
