{
  "$schema": "https://xmintake.github.io/registry/spec/registry/registry-destination.schema.json",
  "id": "mileage",
  "source": "https://xmintake.github.io/registry/destinations/xmintake/mileage.destination.json",
  "title": "Mileage",
  "description": "A drive: why you went, where it started and ended, and the miles.",
  "color": "#1565C0",
  "destinationType": "GOOGLE_SHEET",
  "sheetMode": "TEMPLATE",
  "schemaUrl": "https://xmintake.github.io/registry/schemas/xmintake/mileage.schema.json",
  "visibility": "PUBLIC",
  "primaryCategory": "other",
  "tags": [
    "mileage",
    "travel"
  ],
  "registryStatus": "ACTIVE",
  "createdAt": "2026-10-21T03:51:23Z",
  "issuedAt": "2026-10-21T03:51:23Z",
  "expiresAt": "2027-10-21T03:51:23Z",
  "certificate": {
    "publisher": {
      "name": "XMIntake",
      "type": "COMMUNITY",
      "website": "https://www.xmarin.dev",
      "supportEmail": "support@xmarin.dev",
      "supportPhone": "+1-765-532-6151"
    },
    "quotaPolicy": "SPONSORED",
    "createdAt": "2026-10-21T03:51:23Z",
    "issuedAt": "2026-10-21T03:51:23Z",
    "expiresAt": "2027-10-21T03:51:23Z",
    "signature": "gmmqrvOq0szMfagV55yUZqpfkW48hCRhqKEI09gB1P1hJS78go8CM4BqJjZcmd3ABfCazcxM2Z17xSd0c7BxAg=="
  }
}
