{
  "$schema": "https://xmintake.github.io/registry/spec/registry/registry-destination.schema.json",
  "id": "house-file-bill",
  "source": "https://xmintake.github.io/registry/destinations/xmintake/house-file-bill.destination.json",
  "title": "Bill",
  "description": "A vendor bill or receipt, scanned.",
  "color": "#6D4C41",
  "destinationType": "GOOGLE_SHEET",
  "sheetMode": "TEMPLATE",
  "schemaUrl": "https://xmintake.github.io/registry/schemas/xmintake/house-file-bill.schema.json",
  "visibility": "PUBLIC",
  "primaryCategory": "other",
  "tags": [
    "house",
    "receipt"
  ],
  "registryStatus": "ACTIVE",
  "createdAt": "2026-10-21T03:15:29Z",
  "issuedAt": "2026-10-21T03:15:29Z",
  "expiresAt": "2027-10-21T03:15:29Z",
  "certificate": {
    "publisher": {
      "name": "XMIntake",
      "type": "COMMUNITY",
      "website": "https://www.xmarin.dev",
      "supportEmail": "support@xmarin.dev",
      "supportPhone": "Not listed"
    },
    "quotaPolicy": "SPONSORED",
    "createdAt": "2026-10-21T03:15:29Z",
    "issuedAt": "2026-10-21T03:15:29Z",
    "expiresAt": "2027-10-21T03:15:29Z",
    "signature": "qnlLm4GAQJ9wUGuI9Kb27JKQHEfEuItkWUE7xuoh4swRJUVmzX5dOIuSnttJNAxlir0xceq0Dyv0nnASGaaDCg=="
  }
}
