{
  "$schema": "https://xmintake.github.io/registry/spec/registry/registry-destination.schema.json",
  "id": "package-log",
  "source": "https://xmintake.github.io/registry/destinations/xmintake/package-log.destination.json",
  "title": "Package",
  "description": "A parcel that arrived: tracking code, condition, photo, and where it was.",
  "color": "#00897B",
  "destinationType": "GOOGLE_SHEET",
  "sheetMode": "TEMPLATE",
  "schemaUrl": "https://xmintake.github.io/registry/schemas/xmintake/package-log.schema.json",
  "visibility": "PUBLIC",
  "primaryCategory": "other",
  "tags": [
    "package",
    "delivery"
  ],
  "registryStatus": "ACTIVE",
  "createdAt": "2026-10-21T03:51:23Z",
  "issuedAt": "2026-10-21T03:51:23Z",
  "expiresAt": "2027-10-21T03:51:23Z",
  "certificate": {
    "publisher": {
      "name": "XMIntake",
      "type": "COMMUNITY",
      "website": "https://www.xmarin.dev",
      "supportEmail": "support@xmarin.dev",
      "supportPhone": "+1-765-532-6151"
    },
    "quotaPolicy": "SPONSORED",
    "createdAt": "2026-10-21T03:51:23Z",
    "issuedAt": "2026-10-21T03:51:23Z",
    "expiresAt": "2027-10-21T03:51:23Z",
    "signature": "W17HqzCqSGHma0QIMq13U5AOiaMyMosq1jsx9jBWxSWu/NBgtc+/2gYcdAtfDArbGO3xzHnEayk5SmztHmx5BA=="
  }
}
