{
  "$schema": "https://xmintake.github.io/registry/spec/registry/registry-destination.schema.json",
  "id": "class-roll",
  "source": "https://xmintake.github.io/registry/destinations/xmintake/class-roll.destination.json",
  "title": "Class roll",
  "description": "Attendance for a class, recorded by subject code rather than a full name.",
  "color": "#2E7D32",
  "destinationType": "GOOGLE_SHEET",
  "sheetMode": "TEMPLATE",
  "schemaUrl": "https://xmintake.github.io/registry/schemas/xmintake/class-roll.schema.json",
  "visibility": "PUBLIC",
  "primaryCategory": "education",
  "tags": [
    "class",
    "attendance"
  ],
  "registryStatus": "ACTIVE",
  "createdAt": "2026-10-21T03:51:21Z",
  "issuedAt": "2026-10-21T03:51:21Z",
  "expiresAt": "2027-10-21T03:51:21Z",
  "certificate": {
    "publisher": {
      "name": "XMIntake",
      "type": "COMMUNITY",
      "website": "https://www.xmarin.dev",
      "supportEmail": "support@xmarin.dev",
      "supportPhone": "+1-765-532-6151"
    },
    "quotaPolicy": "SPONSORED",
    "createdAt": "2026-10-21T03:51:21Z",
    "issuedAt": "2026-10-21T03:51:21Z",
    "expiresAt": "2027-10-21T03:51:21Z",
    "signature": "Uo5zynsBCwgCHhsF4zegd/QSWp7eQOyzGChxjlEUG89BKSYhPzlfTbH2FVZuyaPGcamuCm4RdsqsHvkcpbt8Bg=="
  }
}
