{
  "$schema": "https://xmintake.github.io/registry/spec/registry/registry-destination.schema.json",
  "id": "donation",
  "source": "https://xmintake.github.io/registry/destinations/xmintake/donation.destination.json",
  "title": "Donation",
  "description": "A gift received: donor code, campaign, amount, and the receipt.",
  "color": "#455A64",
  "destinationType": "GOOGLE_SHEET",
  "sheetMode": "TEMPLATE",
  "schemaUrl": "https://xmintake.github.io/registry/schemas/xmintake/donation.schema.json",
  "visibility": "PUBLIC",
  "primaryCategory": "other",
  "tags": [
    "donation",
    "receipt"
  ],
  "registryStatus": "ACTIVE",
  "createdAt": "2026-10-21T03:51:22Z",
  "issuedAt": "2026-10-21T03:51:22Z",
  "expiresAt": "2027-10-21T03:51:22Z",
  "certificate": {
    "publisher": {
      "name": "XMIntake",
      "type": "COMMUNITY",
      "website": "https://www.xmarin.dev",
      "supportEmail": "support@xmarin.dev",
      "supportPhone": "Not listed"
    },
    "quotaPolicy": "NORMAL",
    "createdAt": "2026-10-21T03:51:22Z",
    "issuedAt": "2026-10-21T03:51:22Z",
    "expiresAt": "2027-10-21T03:51:22Z",
    "signature": "v1lzx/kNSPPhntVpByrw0XcqTmgz7+16r9cCgHHoZn8spF/eyjp7EIDTbMV1iJ6w9YI2fPMbauYsmjjv6fBzAg=="
  }
}
