{
  "$schema": "https://xmintake.github.io/registry/spec/registry/registry-destination.schema.json",
  "id": "stall-book-batch",
  "source": "https://xmintake.github.io/registry/destinations/xmintake/stall-book-batch.destination.json",
  "title": "Batch",
  "description": "A made batch: lot code, photo, and where it is stored.",
  "color": "#EF6C00",
  "destinationType": "GOOGLE_SHEET",
  "sheetMode": "TEMPLATE",
  "schemaUrl": "https://xmintake.github.io/registry/schemas/xmintake/stall-book-batch.schema.json",
  "visibility": "PUBLIC",
  "primaryCategory": "other",
  "tags": [
    "stall",
    "batch"
  ],
  "registryStatus": "ACTIVE",
  "createdAt": "2026-10-21T03:15:30Z",
  "issuedAt": "2026-10-21T03:15:30Z",
  "expiresAt": "2027-10-21T03:15:30Z",
  "certificate": {
    "publisher": {
      "name": "XMIntake",
      "type": "COMMUNITY",
      "website": "https://www.xmarin.dev",
      "supportEmail": "support@xmarin.dev",
      "supportPhone": "Not listed"
    },
    "quotaPolicy": "SPONSORED",
    "createdAt": "2026-10-21T03:15:30Z",
    "issuedAt": "2026-10-21T03:15:30Z",
    "expiresAt": "2027-10-21T03:15:30Z",
    "signature": "T5D7HMcpYYqlbTYuhvwvKS/ILYBU9DSqnXpSkVpEdR+HHlJnIeVO0kN+P8CnzfIMx+Hr2SkhkubBJxDlEolYAw=="
  }
}
