{
  "$schema": "https://xmintake.github.io/registry/spec/registry/registry-destination.schema.json",
  "id": "house-file-room",
  "source": "https://xmintake.github.io/registry/destinations/xmintake/house-file-room.destination.json",
  "title": "Room",
  "description": "A room, with a door tag, a photo, and its condition.",
  "color": "#6D4C41",
  "destinationType": "GOOGLE_SHEET",
  "sheetMode": "TEMPLATE",
  "schemaUrl": "https://xmintake.github.io/registry/schemas/xmintake/house-file-room.schema.json",
  "visibility": "PUBLIC",
  "primaryCategory": "other",
  "tags": [
    "house",
    "room"
  ],
  "registryStatus": "ACTIVE",
  "createdAt": "2026-10-21T03:15:29Z",
  "issuedAt": "2026-10-21T03:15:29Z",
  "expiresAt": "2027-10-21T03:15:29Z",
  "certificate": {
    "publisher": {
      "name": "XMIntake",
      "type": "COMMUNITY",
      "website": "https://www.xmarin.dev",
      "supportEmail": "support@xmarin.dev",
      "supportPhone": "+1-765-532-6151"
    },
    "quotaPolicy": "SPONSORED",
    "createdAt": "2026-10-21T03:15:29Z",
    "issuedAt": "2026-10-21T03:15:29Z",
    "expiresAt": "2027-10-21T03:15:29Z",
    "signature": "DV0awzZwrgP7y+MXawrFLa7/AafCiCkBGC7t55SiQQ3LEEUnbikqyO1kb98l01t9RJO9EMF89c2L6ibcsfUPAg=="
  }
}
