{
  "$schema": "https://xmintake.github.io/registry/spec/registry/registry-destination.schema.json",
  "id": "payment-in",
  "source": "https://xmintake.github.io/registry/destinations/xmintake/payment-in.destination.json",
  "title": "Payment in",
  "description": "Money that came in, with the reference and the invoice it pays.",
  "color": "#1565C0",
  "destinationType": "GOOGLE_SHEET",
  "sheetMode": "TEMPLATE",
  "schemaUrl": "https://xmintake.github.io/registry/schemas/xmintake/payment-in.schema.json",
  "visibility": "PUBLIC",
  "primaryCategory": "other",
  "tags": [
    "payment"
  ],
  "registryStatus": "ACTIVE",
  "createdAt": "2026-10-21T03:51:23Z",
  "issuedAt": "2026-10-21T03:51:23Z",
  "expiresAt": "2027-10-21T03:51:23Z",
  "certificate": {
    "publisher": {
      "name": "XMIntake",
      "type": "COMMUNITY",
      "website": "https://www.xmarin.dev",
      "supportEmail": "support@xmarin.dev",
      "supportPhone": "+1-765-532-6151"
    },
    "quotaPolicy": "SPONSORED",
    "createdAt": "2026-10-21T03:51:23Z",
    "issuedAt": "2026-10-21T03:51:23Z",
    "expiresAt": "2027-10-21T03:51:23Z",
    "signature": "mwVV4TyW0HbWTy/kbv21wXLQXHwbFimKm11sDe2XcPUNvvc50EfDnVeWHXy5K0obcVPA5L+tZM0tjYpbaEW8CA=="
  }
}
