{
  "$schema": "https://xmintake.github.io/registry/spec/registry/registry-destination.schema.json",
  "id": "refund",
  "source": "https://xmintake.github.io/registry/destinations/xmintake/refund.destination.json",
  "title": "Refund",
  "description": "Money returned to you, with the original reference and the receipt.",
  "color": "#1565C0",
  "destinationType": "GOOGLE_SHEET",
  "sheetMode": "TEMPLATE",
  "schemaUrl": "https://xmintake.github.io/registry/schemas/xmintake/refund.schema.json",
  "visibility": "PUBLIC",
  "primaryCategory": "other",
  "tags": [
    "refund",
    "receipt"
  ],
  "registryStatus": "ACTIVE",
  "createdAt": "2026-10-21T03:51:24Z",
  "issuedAt": "2026-10-21T03:51:24Z",
  "expiresAt": "2027-10-21T03:51:24Z",
  "certificate": {
    "publisher": {
      "name": "XMIntake",
      "type": "COMMUNITY",
      "website": "https://www.xmarin.dev",
      "supportEmail": "support@xmarin.dev",
      "supportPhone": "Not listed"
    },
    "quotaPolicy": "SPONSORED",
    "createdAt": "2026-10-21T03:51:24Z",
    "issuedAt": "2026-10-21T03:51:24Z",
    "expiresAt": "2027-10-21T03:51:24Z",
    "signature": "tA9Gggq/QnOFcQW+z7GxuPmobioVj8DbFQlUM4AwLwZTUl53K8yy9eV4QpGxWzIXN8BUJjLM2f5M7xcrVaPNBQ=="
  }
}
