{
  "$schema": "https://xmintake.github.io/registry/spec/registry/registry-destination.schema.json",
  "id": "job-round-part",
  "source": "https://xmintake.github.io/registry/destinations/xmintake/job-round-part.destination.json",
  "title": "Part",
  "description": "A part used on the job, identified by its code.",
  "color": "#1565C0",
  "destinationType": "GOOGLE_SHEET",
  "sheetMode": "TEMPLATE",
  "schemaUrl": "https://xmintake.github.io/registry/schemas/xmintake/job-round-part.schema.json",
  "visibility": "PUBLIC",
  "primaryCategory": "field-work",
  "tags": [
    "job",
    "part"
  ],
  "registryStatus": "ACTIVE",
  "createdAt": "2026-10-21T03:15:30Z",
  "issuedAt": "2026-10-21T03:15:30Z",
  "expiresAt": "2027-10-21T03:15:30Z",
  "certificate": {
    "publisher": {
      "name": "XMIntake",
      "type": "COMMUNITY",
      "website": "https://www.xmarin.dev",
      "supportEmail": "support@xmarin.dev",
      "supportPhone": "Not listed"
    },
    "quotaPolicy": "SPONSORED",
    "createdAt": "2026-10-21T03:15:30Z",
    "issuedAt": "2026-10-21T03:15:30Z",
    "expiresAt": "2027-10-21T03:15:30Z",
    "signature": "W9fzQ6bDdJF/hfvw9g6KnGQClzib2RqhHb0+K56t57WSI9k9RqkjgCicQanxlaJ0lGz6smbbxtVk+G3JVhIfDg=="
  }
}
