{
  "$schema": "https://xmintake.github.io/registry/spec/registry/registry-destination.schema.json",
  "id": "service-record",
  "source": "https://xmintake.github.io/registry/destinations/xmintake/service-record.destination.json",
  "title": "Service record",
  "description": "Work done on something you own: the tag, the vendor, the cost, and the paperwork.",
  "color": "#00897B",
  "destinationType": "GOOGLE_SHEET",
  "sheetMode": "TEMPLATE",
  "schemaUrl": "https://xmintake.github.io/registry/schemas/xmintake/service-record.schema.json",
  "visibility": "PUBLIC",
  "primaryCategory": "other",
  "tags": [
    "service",
    "maintenance"
  ],
  "registryStatus": "ACTIVE",
  "createdAt": "2026-10-21T03:51:24Z",
  "issuedAt": "2026-10-21T03:51:24Z",
  "expiresAt": "2027-10-21T03:51:24Z",
  "certificate": {
    "publisher": {
      "name": "XMIntake",
      "type": "COMMUNITY",
      "website": "https://www.xmarin.dev",
      "supportEmail": "support@xmarin.dev",
      "supportPhone": "Not listed"
    },
    "quotaPolicy": "SPONSORED",
    "createdAt": "2026-10-21T03:51:24Z",
    "issuedAt": "2026-10-21T03:51:24Z",
    "expiresAt": "2027-10-21T03:51:24Z",
    "signature": "y9hF2sU0105DGHWso2+KOgYO1CXZiSpRGq1F7s0+g+wGAG3/YxXB28doDuSrdK9SEy8NPytBWAmpRWJcixglBQ=="
  }
}
