{
  "$schema": "https://xmintake.github.io/registry/spec/registry/registry-destination.schema.json",
  "id": "field-lead",
  "source": "https://xmintake.github.io/registry/destinations/xmintake/field-lead.destination.json",
  "title": "Field lead",
  "description": "A person or company you met in the field: a scan of the card and the next step.",
  "color": "#EF6C00",
  "destinationType": "GOOGLE_SHEET",
  "sheetMode": "TEMPLATE",
  "schemaUrl": "https://xmintake.github.io/registry/schemas/xmintake/field-lead.schema.json",
  "visibility": "PUBLIC",
  "primaryCategory": "field-work",
  "tags": [
    "lead"
  ],
  "registryStatus": "ACTIVE",
  "createdAt": "2026-10-21T03:51:22Z",
  "issuedAt": "2026-10-21T03:51:22Z",
  "expiresAt": "2027-10-21T03:51:22Z",
  "certificate": {
    "publisher": {
      "name": "XMIntake",
      "type": "COMMUNITY",
      "website": "https://www.xmarin.dev",
      "supportEmail": "support@xmarin.dev",
      "supportPhone": "Not listed"
    },
    "quotaPolicy": "NORMAL",
    "createdAt": "2026-10-21T03:51:22Z",
    "issuedAt": "2026-10-21T03:51:22Z",
    "expiresAt": "2027-10-21T03:51:22Z",
    "signature": "be2X0nEwYoGgPBUkuhB7Qdat3t53A58UHzffPWjA2D4ESsytt/Dy72sC7HddI5949goEMtKpI6L5EhTIrLgBCg=="
  }
}
