{
  "$schema": "https://xmintake.github.io/registry/spec/registry/registry-destination.schema.json",
  "id": "trip-book-moment",
  "source": "https://xmintake.github.io/registry/destinations/xmintake/trip-book-moment.destination.json",
  "title": "Moment",
  "description": "A short video of a moment, with where it was.",
  "color": "#00897B",
  "destinationType": "GOOGLE_SHEET",
  "sheetMode": "TEMPLATE",
  "schemaUrl": "https://xmintake.github.io/registry/schemas/xmintake/trip-book-moment.schema.json",
  "visibility": "PUBLIC",
  "primaryCategory": "other",
  "tags": [
    "trip",
    "video"
  ],
  "registryStatus": "ACTIVE",
  "createdAt": "2026-10-21T03:15:31Z",
  "issuedAt": "2026-10-21T03:15:31Z",
  "expiresAt": "2027-10-21T03:15:31Z",
  "certificate": {
    "publisher": {
      "name": "XMIntake",
      "type": "COMMUNITY",
      "website": "https://www.xmarin.dev",
      "supportEmail": "support@xmarin.dev",
      "supportPhone": "+1-765-532-6151"
    },
    "quotaPolicy": "SPONSORED",
    "createdAt": "2026-10-21T03:15:31Z",
    "issuedAt": "2026-10-21T03:15:31Z",
    "expiresAt": "2027-10-21T03:15:31Z",
    "signature": "3Qs3+V7EBPIYkjXQjqxLl9Lq20AzepNR8vsu/CaB5ZtbKcYg/7HelgwxlndMlYH3efTrMjqKLKxtO1FL4ZVFAQ=="
  }
}
