{
  "$schema": "https://xmintake.github.io/registry/spec/registry/registry-destination.schema.json",
  "id": "house-file-home",
  "source": "https://xmintake.github.io/registry/destinations/xmintake/house-file-home.destination.json",
  "title": "Home",
  "description": "The building: address, pin, and a photo of the front.",
  "color": "#6D4C41",
  "destinationType": "GOOGLE_SHEET",
  "sheetMode": "TEMPLATE",
  "schemaUrl": "https://xmintake.github.io/registry/schemas/xmintake/house-file-home.schema.json",
  "visibility": "PUBLIC",
  "primaryCategory": "other",
  "tags": [
    "house"
  ],
  "registryStatus": "ACTIVE",
  "createdAt": "2026-10-21T03:15:29Z",
  "issuedAt": "2026-10-21T03:15:29Z",
  "expiresAt": "2027-10-21T03:15:29Z",
  "certificate": {
    "publisher": {
      "name": "XMIntake",
      "type": "COMMUNITY",
      "website": "https://www.xmarin.dev",
      "supportEmail": "support@xmarin.dev",
      "supportPhone": "Not listed"
    },
    "quotaPolicy": "SPONSORED",
    "createdAt": "2026-10-21T03:15:29Z",
    "issuedAt": "2026-10-21T03:15:29Z",
    "expiresAt": "2027-10-21T03:15:29Z",
    "signature": "O2bO7hkQgFZDRbfsusK+P5j5BgKJaGo433HYU+47j4gWHK49yS2EeQHlzYR1bsTxdFY8LG5lbpId4b9HSxWIDQ=="
  }
}
